{
  "schema_version": "souldrive_run_manifest_v0.1",
  "run_id": "b0_current_20260817",
  "created_at": "2026-08-17T13:41:41.184755+00:00",
  "baseline_level": "B0_CURRENT",
  "status": "partial",
  "repository": {
    "head": "0e216835775a93ed263e57911b6d6aa31d813acc",
    "branch": "main",
    "tracked_diff_sha256": "271938619df247feef7c51b09ecc1596a38d0dd32430b16d511a0fc12a5ae26a",
    "untracked_files": [
      {
        "path": "core/document_types.py",
        "sha256": "327196f8a29b57dc5575e765f093465548a8384db05beb32c62d3c44e9e669aa"
      },
      {
        "path": "core/image_ocr.py",
        "sha256": "174b8a715f0cbe82c280160309f7ee214c32af402f6104f16ac0460b32923f17"
      },
      {
        "path": "core/interaction_context.py",
        "sha256": "c219c672d9ccff4bf5fc49383260b9553dc48550a9888856d9b8dc19b8f88cff"
      },
      {
        "path": "docs/contest_topic5_product_blueprint.md",
        "sha256": "e8c18f6960f171f31081f7f01075d63df520da5274f04903f1d170ca6d235bf2"
      },
      {
        "path": "docs/image_ocr_evaluation_protocol.md",
        "sha256": "0438f84623d7779b3f3465c4bb0a7acf97de25362e2ab336f05244959ba82489"
      },
      {
        "path": "docs/superpowers/plans/2026-08-17-souldrive-pc-multimodal-execution-plan.md",
        "sha256": "cad1f26f1c638ad09e2ab77d78555611ad83e3cf59f0bdb253db3c1178b2ab5e"
      },
      {
        "path": "docs/superpowers/specs/2026-08-17-souldrive-pc-multimodal-project-spec.md",
        "sha256": "43acdd2f87ac83c5ec58689c3fc7ad5cea11af9a968eed2a0763b5e9b8a7d213"
      },
      {
        "path": "eval/schemas/episode_v0.1.schema.json",
        "sha256": "6d3be675383474a26c77e7f2ecc6566afc672fb2be07a436b6745d0043e43f3d"
      },
      {
        "path": "eval/schemas/infer_response_v0.1.schema.json",
        "sha256": "c1c44d3fe1617886c1d7a8e1c6f341edd21ce91020d0f49589fd83a3f73ec378"
      },
      {
        "path": "eval/schemas/run_manifest_v0.1.schema.json",
        "sha256": "5873b40893677443ef71f53a251781a3ba361e05944373493abaeb9ab82cada8"
      },
      {
        "path": "scripts/capture_b0_baseline.py",
        "sha256": "ae5527ff99e46938c8169bc4b877cd75db1e6b2a9e65227a03867f4c7cf74e9c"
      },
      {
        "path": "scripts/eval_image_ocr.py",
        "sha256": "181660272ec660fe5ad7c359c724b751304c32e37978839f75724ee732951ead"
      },
      {
        "path": "tests/test_baseline_schemas.py",
        "sha256": "b05fc90d1896f5be642310acb997b4aa86149f2eeb4b7b96e8a750a7264d8ea8"
      },
      {
        "path": "tests/test_image_ocr.py",
        "sha256": "835afb77578c7e66b1f491c3a2e4ab2c9feb428b61bf5b940242f80c14b92101"
      },
      {
        "path": "tests/test_image_ocr_eval.py",
        "sha256": "68a6ed9d5a2cda67225b1ea38f370a2bda2b67ddad1e4a6710b75adf8af582c6"
      },
      {
        "path": "tests/test_interaction_context.py",
        "sha256": "ccdc778c28c30bdb18dc13579c5949ee4ba5c2db16f79e0cdd3b080f7bb25584"
      }
    ],
    "workspace_state_sha256": "7ac0f23dbf3d457cc2dd29d369d216b428c1cc9076584cfddbb53e89eb62a754"
  },
  "environment": {
    "os": "Windows-10-10.0.26200-SP0",
    "python": "3.10.20",
    "conda_environment": "souldrive",
    "packages": {
      "cryptography": "48.0.1",
      "docling": "2.101.0",
      "fastapi": "0.136.3",
      "langchain-core": "1.4.9",
      "pytest": "7.4.4",
      "rapidocr-onnxruntime": "not-installed"
    },
    "gpu": "NVIDIA GeForce RTX 5060 Laptop GPU, 8151 MiB, 610.62"
  },
  "inputs": [
    {
      "path": "eval/retrieval_quality_blind_v0.3.jsonl",
      "sha256": "4eebe9acd70297953371e564ccb1fddf2a84cd97be7c3480993535233e06d417",
      "bytes": 238152,
      "provenance": "frozen evaluation dataset"
    },
    {
      "path": "eval/results/retrieval_main_after_merge_top6_v0.3.jsonl",
      "sha256": "1fe479d12b7ed9c68ffd8a572c747300143be2d5df00ef61726867fb0aa2b217",
      "bytes": 2771097,
      "provenance": "archived per-sample predictions"
    },
    {
      "path": "eval/results/ingestion_structure_v0.5.json",
      "sha256": "9a2f63bf1d87eb755c522fb717925526cd452cbc97f514e58cba90dd808b37bc",
      "bytes": 265336,
      "provenance": "archived ingestion aggregate"
    }
  ],
  "components": {
    "retrieval": "archived predictions + current eval_rag summarizer",
    "ingestion": "archived aggregate report",
    "tests": "410 passed, 1 warning in 45.56s"
  },
  "outputs": {
    "predictions": "predictions.jsonl",
    "metrics": "metrics.json",
    "latency": "latency.jsonl",
    "failures": "failures.jsonl",
    "summary": "summary.md"
  },
  "limitations": [
    "SOULDRIVE_WORKSPACE was not configured for a live retrieval replay.",
    "The original 36-document evaluation corpus was not available on this machine.",
    "Retrieval predictions and ingestion metrics are archived evidence, not a fresh end-to-end run.",
    "OCR and full answer-generation baselines require separate fixed datasets."
  ]
}
